{
  "schemaVersion": 2,
  "sourceCommit": "c3a6213e35a3a49dbff2bee5ac4d489f2c35c050",
  "deploymentId": "palissage-421614-v1.1.0",
  "chainId": 421614,
  "protocolVersion": "1.1.0",
  "status": "verified",
  "verifiedAtBlock": "315305564",
  "verification": "Creation receipts, source hashes, compiled runtime and wiring checked at one snapshot; explorer verification is tracked separately per contract.",
  "deployer": "0xDCf00f1A5600c6191Fbc8d333A4C004903580A85",
  "explorerUrl": "https://sepolia.arbiscan.io",
  "contracts": {
    "trustedIssuersRegistry": {
      "name": "TrustedIssuersRegistry",
      "address": "0x9b826155728e81ea8a9593873f34a3dd74abc69b",
      "creationTx": "0x37873f9e600e554509b631601763c79414a5f325c909aba84e8e7a7be961f74f",
      "creationBlock": "315295899",
      "constructorArgs": "0x000000000000000000000000dcf00f1a5600c6191fbc8d333a4c004903580a85",
      "abiHash": "0x5dfc8d373534e86d4cef78d78f2102198131b80f47bc140ad5bbdf4e5ecb6067",
      "runtimeCodeHash": "0x45c54478c9c78b0d3e6c272e75af83f5d97d4450080b6199d680284a4ac6b5bf",
      "compiler": "0.8.28+commit.7893614a",
      "sourceHashes": {
        "lib/openzeppelin-contracts/contracts/access/AccessControl.sol": "0x4686ec784d75f95beaf2bf5b5f26e5f946d4c864aaee9c3c62bdc18381f5e017",
        "lib/openzeppelin-contracts/contracts/access/IAccessControl.sol": "0xbff9f59c84e5337689161ce7641c0ef8e872d6a7536fbc1f5133f128887aba3c",
        "lib/openzeppelin-contracts/contracts/utils/Context.sol": "0x493033a8d1b176a037b2cc6a04dad01a5c157722049bbecf632ca876224dd4b2",
        "lib/openzeppelin-contracts/contracts/utils/introspection/ERC165.sol": "0x2d9dc2fe26180f74c11c13663647d38e259e45f95eb88f57b61d2160b0109d3e",
        "lib/openzeppelin-contracts/contracts/utils/introspection/IERC165.sol": "0x8891738ffe910f0cf2da09566928589bf5d63f4524dd734fd9cedbac3274dd5c",
        "src/identity/TrustedIssuersRegistry.sol": "0xd86ea5e30327e54bd6391fd8f05faf02fc023ed9e62fec68a0e204b3b7beaec2",
        "src/interfaces/IClaimIssuer.sol": "0x50b5a572af7b169736cb7819eadf8a81d4ff28f0a5c49e02495d64e5452a710f",
        "src/interfaces/IERC734.sol": "0x9b294674f44ae1f01d90fa0c2df0060027bb11224066d9fce5b7a8ae239ced46",
        "src/interfaces/IERC735.sol": "0xcf1f383d4f383ccddababdf2e1af125305c42f30597cfcbee0241eca3c436f83",
        "src/interfaces/IIdentity.sol": "0xc4ff7991552ecb1e52a802754b53f4a5264112f61eca70f07285437437690b17",
        "src/interfaces/ITrustedIssuersRegistry.sol": "0x359002a531e2a2f07346868a0adcd3b6ea2dc6b9d1c8f860172b91f439bed5ac"
      },
      "explorerSourceVerified": true,
      "sourceExplorerUrl": "https://sepolia.arbiscan.io/address/0x9b826155728e81ea8a9593873f34a3dd74abc69b#code",
      "explorerVerificationKind": "exact-match"
    },
    "identityRegistry": {
      "name": "IdentityRegistry",
      "address": "0x2e437d9d52ece33fa59ad5ff13e0c7106ba93e1f",
      "creationTx": "0x3a8a9ec6bd9a3717ae640364ede0dde440c3ea129134aaa54d25b9d034cbc759",
      "creationBlock": "315295910",
      "constructorArgs": "0x000000000000000000000000dcf00f1a5600c6191fbc8d333a4c004903580a850000000000000000000000009b826155728e81ea8a9593873f34a3dd74abc69b",
      "abiHash": "0xd1b93f06ae5206cb0b56b30f07752d5350de5951cae64e4d0d367ac103f78c70",
      "runtimeCodeHash": "0x9257ef0496c421cc8b107daae1a14e68d3ed3b86ee24401fab460a6bddc53981",
      "compiler": "0.8.28+commit.7893614a",
      "sourceHashes": {
        "lib/openzeppelin-contracts/contracts/access/AccessControl.sol": "0x4686ec784d75f95beaf2bf5b5f26e5f946d4c864aaee9c3c62bdc18381f5e017",
        "lib/openzeppelin-contracts/contracts/access/IAccessControl.sol": "0xbff9f59c84e5337689161ce7641c0ef8e872d6a7536fbc1f5133f128887aba3c",
        "lib/openzeppelin-contracts/contracts/utils/Context.sol": "0x493033a8d1b176a037b2cc6a04dad01a5c157722049bbecf632ca876224dd4b2",
        "lib/openzeppelin-contracts/contracts/utils/introspection/ERC165.sol": "0x2d9dc2fe26180f74c11c13663647d38e259e45f95eb88f57b61d2160b0109d3e",
        "lib/openzeppelin-contracts/contracts/utils/introspection/IERC165.sol": "0x8891738ffe910f0cf2da09566928589bf5d63f4524dd734fd9cedbac3274dd5c",
        "src/identity/IdentityRegistry.sol": "0x4922b94951197d0e042b413e60c21e7969873d7794def27892b08c595b2a9eda",
        "src/interfaces/IClaimIssuer.sol": "0x50b5a572af7b169736cb7819eadf8a81d4ff28f0a5c49e02495d64e5452a710f",
        "src/interfaces/IERC734.sol": "0x9b294674f44ae1f01d90fa0c2df0060027bb11224066d9fce5b7a8ae239ced46",
        "src/interfaces/IERC735.sol": "0xcf1f383d4f383ccddababdf2e1af125305c42f30597cfcbee0241eca3c436f83",
        "src/interfaces/IIdentity.sol": "0xc4ff7991552ecb1e52a802754b53f4a5264112f61eca70f07285437437690b17",
        "src/interfaces/IIdentityRegistry.sol": "0x68199dafc42c0aff02fec4fb49c287b4fcd124f75177735687615428df67c693",
        "src/interfaces/ITrustedIssuersRegistry.sol": "0x359002a531e2a2f07346868a0adcd3b6ea2dc6b9d1c8f860172b91f439bed5ac",
        "src/libraries/ClaimTopicsLib.sol": "0xcd8e73e9f88b54ded84b8a70dae792d5249fe987088c39b8dbaa460ac4555ae2"
      },
      "explorerSourceVerified": true,
      "sourceExplorerUrl": "https://sepolia.arbiscan.io/address/0x2e437d9d52ece33fa59ad5ff13e0c7106ba93e1f#code",
      "explorerVerificationKind": "exact-match"
    },
    "wineLotToken": {
      "name": "WineLotToken",
      "address": "0x9bc6bca932359c336c13b0ea9d4b249774882a7b",
      "creationTx": "0x282635d058257c49e989de4dd4ea02121cee16501c3c97d86ed8c9eb90a97d7c",
      "creationBlock": "315295920",
      "constructorArgs": "0x000000000000000000000000dcf00f1a5600c6191fbc8d333a4c004903580a850000000000000000000000002e437d9d52ece33fa59ad5ff13e0c7106ba93e1f",
      "abiHash": "0x5ca3b7c253cec2d7cf022c5ac994d4d05a75c3745168d675f3267c44e190d9ec",
      "runtimeCodeHash": "0xc52a8bde7bb7d69e663686406e25ed29d8d8dc91b1c3d5fa2fe4446a42a6a0de",
      "compiler": "0.8.28+commit.7893614a",
      "sourceHashes": {
        "lib/openzeppelin-contracts/contracts/access/AccessControl.sol": "0x4686ec784d75f95beaf2bf5b5f26e5f946d4c864aaee9c3c62bdc18381f5e017",
        "lib/openzeppelin-contracts/contracts/access/IAccessControl.sol": "0xbff9f59c84e5337689161ce7641c0ef8e872d6a7536fbc1f5133f128887aba3c",
        "lib/openzeppelin-contracts/contracts/interfaces/draft-IERC6093.sol": "0x1b88b3fb3d85ba5496d7d5f396f83ee1fddcdd6762059ff65992655b67920998",
        "lib/openzeppelin-contracts/contracts/token/ERC1155/ERC1155.sol": "0x405aba2c4c654f9ee77437739109afc694bec03a074f978733c11205927d774b",
        "lib/openzeppelin-contracts/contracts/token/ERC1155/IERC1155.sol": "0xf189f9b417fe1931e1ab706838aff1128528694a9fcdb5ff7665197f2ca57d09",
        "lib/openzeppelin-contracts/contracts/token/ERC1155/IERC1155Receiver.sol": "0x6ec6d7fce29668ede560c7d2e10f9d10de3473f5298e431e70a5767db42fa620",
        "lib/openzeppelin-contracts/contracts/token/ERC1155/extensions/ERC1155Supply.sol": "0xf7a3a3aadaec19ab6e38797cd0ad90a903ff056c33e830d1aa16e67de9fe55c6",
        "lib/openzeppelin-contracts/contracts/token/ERC1155/extensions/IERC1155MetadataURI.sol": "0x98c32de9b02f43eba7c0aba9fadf331cffb35a8d2076dce1d556c8f2cad704aa",
        "lib/openzeppelin-contracts/contracts/token/ERC1155/utils/ERC1155Utils.sol": "0xaeca1511f7da49bdb16e44aa0f09dca76b51ba079bd068b2f80b8fe6d22b5fa1",
        "lib/openzeppelin-contracts/contracts/utils/Arrays.sol": "0xb3b81029526a4c3acf39e57cc446407141ebce338cc99585942af1340e1a69e0",
        "lib/openzeppelin-contracts/contracts/utils/Comparators.sol": "0x302eecd8cf323b4690e3494a7d960b3cbce077032ab8ef655b323cdd136cec58",
        "lib/openzeppelin-contracts/contracts/utils/Context.sol": "0x493033a8d1b176a037b2cc6a04dad01a5c157722049bbecf632ca876224dd4b2",
        "lib/openzeppelin-contracts/contracts/utils/Panic.sol": "0xf7fe324703a64fc51702311dc51562d5cb1497734f074e4f483bfb6717572d7a",
        "lib/openzeppelin-contracts/contracts/utils/SlotDerivation.sol": "0x94045fd4f268edf2b2d01ef119268548c320366d6f5294ad30c1b8f9d4f5225f",
        "lib/openzeppelin-contracts/contracts/utils/StorageSlot.sol": "0xcf74f855663ce2ae00ed8352666b7935f6cddea2932fdf2c3ecd30a9b1cd0e97",
        "lib/openzeppelin-contracts/contracts/utils/introspection/ERC165.sol": "0x2d9dc2fe26180f74c11c13663647d38e259e45f95eb88f57b61d2160b0109d3e",
        "lib/openzeppelin-contracts/contracts/utils/introspection/IERC165.sol": "0x8891738ffe910f0cf2da09566928589bf5d63f4524dd734fd9cedbac3274dd5c",
        "lib/openzeppelin-contracts/contracts/utils/math/Math.sol": "0x59973a93b1f983f94e10529f46ca46544a9fec2b5f56fb1390bbe9e0dc79f857",
        "lib/openzeppelin-contracts/contracts/utils/math/SafeCast.sol": "0xc8cae21c9ae4a46e5162ff9bf5b351d6fa6a6eba72d515f3bc1bdfeda7fdf083",
        "src/interfaces/IERC734.sol": "0x9b294674f44ae1f01d90fa0c2df0060027bb11224066d9fce5b7a8ae239ced46",
        "src/interfaces/IERC735.sol": "0xcf1f383d4f383ccddababdf2e1af125305c42f30597cfcbee0241eca3c436f83",
        "src/interfaces/IERC7943.sol": "0xc6e7dd6dea3d1413a84717d7d8ca9c8fca116d85194458bb524c99e3779d5681",
        "src/interfaces/IIdentity.sol": "0xc4ff7991552ecb1e52a802754b53f4a5264112f61eca70f07285437437690b17",
        "src/interfaces/IIdentityRegistry.sol": "0x68199dafc42c0aff02fec4fb49c287b4fcd124f75177735687615428df67c693",
        "src/interfaces/IWineLotToken.sol": "0x89c2634d9d7b51a26cccc1cfa021660c9b99c9da7b0715d3463ec632bbb265c9",
        "src/libraries/ClaimTopicsLib.sol": "0xcd8e73e9f88b54ded84b8a70dae792d5249fe987088c39b8dbaa460ac4555ae2",
        "src/token/WineLotToken.sol": "0x57e0bd8cd760a207b642dceca09350ecb59ff6824bea4a9df9d731b3ee392bfe"
      },
      "explorerSourceVerified": true,
      "sourceExplorerUrl": "https://sepolia.arbiscan.io/address/0x9bc6bca932359c336c13b0ea9d4b249774882a7b#code",
      "explorerVerificationKind": "exact-match"
    },
    "primaryMarket": {
      "name": "PrimaryMarket",
      "address": "0x191af3012e33228f2a6c6e4df33c81f87cddfeb4",
      "creationTx": "0x00afd945bcae7c19112867dda7af271131824c3a4d268ede168ec36c67489582",